{
  "$schema": "https://json-schema.org/draft/2020-12/schema",
  "$id": "https://github.com/Goldkelch/qik-vrt/blob/main/policy/qikvrt-status-report-release-request.schema.json",
  "title": "QIK-VRT status clarification release request",
  "description": "Closed, initially inert authorization marker for a fresh standalone status-report deposition and source-parent tags in the two QIK-VRT repositories.",
  "type": "object",
  "additionalProperties": false,
  "required": [
    "_license",
    "$schema_ref",
    "schema",
    "schema_sha256",
    "request_id",
    "action",
    "confirm",
    "authorization_payload_sha256",
    "repository_policy",
    "release",
    "zenodo"
  ],
  "properties": {
    "_license": {
      "type": "object",
      "additionalProperties": false,
      "required": ["copyright", "rights_holder", "license", "license_text_ref", "classification"],
      "properties": {
        "copyright": {"const": "Copyright 2026 Ingolf Lohmann"},
        "rights_holder": {"const": "Ingolf Lohmann"},
        "license": {"const": "CC-BY-NC-ND-4.0"},
        "license_text_ref": {"const": "LICENSES/CC-BY-NC-ND-4.0.txt"},
        "classification": {"const": "release_authorization_json"}
      }
    },
    "$schema_ref": {"const": "../policy/qikvrt-status-report-release-request.schema.json"},
    "schema": {"const": "qikvrt_status_report_release_request_v1"},
    "schema_sha256": {"$ref": "#/$defs/sha256"},
    "request_id": {"const": "status-clarification-2026-07-22"},
    "action": {"enum": ["inactive", "reserve", "finalize"]},
    "confirm": {
      "enum": [
        "NOT_AUTHORIZED",
        "RESERVE_ONE_NEW_STATUS_REPORT_DRAFT_NO_PUBLISH",
        "TAG_SOURCE_PARENTS_AND_PUBLISH_RESERVED_STATUS_REPORT"
      ]
    },
    "authorization_payload_sha256": {"$ref": "#/$defs/sha256"},
    "repository_policy": {
      "type": "object",
      "additionalProperties": false,
      "required": [
        "authority_repository",
        "mirror_repository",
        "release_ref",
        "reserve_ref",
        "finalize_ref",
        "state_branch"
      ],
      "properties": {
        "authority_repository": {"const": "Goldkelch/qik-vrt"},
        "mirror_repository": {"const": "ingolf-lohmann/qik-vrt"},
        "release_ref": {"const": "refs/heads/main"},
        "reserve_ref": {"const": "refs/heads/automation/status-clarification-reserve-20260722"},
        "finalize_ref": {"const": "refs/heads/automation/status-clarification-finalize-20260722"},
        "state_branch": {"const": "qikvrt/status-report-state"}
      }
    },
    "release": {
      "type": "object",
      "additionalProperties": false,
      "required": [
        "version",
        "tag",
        "expected_source_commits",
        "expected_source_tree",
        "tagger_name",
        "tagger_email",
        "tagger_timestamp",
        "tag_message"
      ],
      "properties": {
        "version": {"const": "2026.07.22-status-clarification-1.0.0"},
        "tag": {"const": "v2026.07.22-status-clarification-1.0.0"},
        "expected_source_commits": {
          "type": "object",
          "additionalProperties": false,
          "required": ["Goldkelch/qik-vrt", "ingolf-lohmann/qik-vrt"],
          "properties": {
            "Goldkelch/qik-vrt": {"$ref": "#/$defs/gitSha1"},
            "ingolf-lohmann/qik-vrt": {"$ref": "#/$defs/gitSha1"}
          }
        },
        "expected_source_tree": {"$ref": "#/$defs/gitSha1"},
        "tagger_name": {"const": "Ingolf Lohmann"},
        "tagger_email": {"const": "ingolf.lohmann@live.com"},
        "tagger_timestamp": {"const": "2026-07-22T00:00:00Z"},
        "tag_message": {"const": "QIK-VRT official status clarification 1.0.0\n\nStandalone bounded status report. Tags identify the reviewed source-parent trees; authorization-marker commits are not release targets. No GitHub Release object and no mutation or new version of an existing Zenodo record."}
      }
    },
    "zenodo": {
      "type": "object",
      "additionalProperties": false,
      "required": [
        "client_path",
        "client_sha256",
        "reservation_manifest_path",
        "reservation_manifest_sha256",
        "final_template_manifest_path",
        "final_template_manifest_sha256",
        "final_manifest_path",
        "final_manifest_sha256",
        "reservation_state_path",
        "reservation_evidence_sha256",
        "report_doi"
      ],
      "properties": {
        "client_path": {"const": "tools/qikvrt_status_zenodo.py"},
        "client_sha256": {"$ref": "#/$defs/sha256"},
        "reservation_manifest_path": {"const": "release/status-clarification-zenodo-reservation-manifest.json"},
        "reservation_manifest_sha256": {"$ref": "#/$defs/sha256"},
        "final_template_manifest_path": {"const": "release/status-clarification-zenodo-template.json"},
        "final_template_manifest_sha256": {"$ref": "#/$defs/sha256"},
        "final_manifest_path": {"const": "release/status-clarification-zenodo.json"},
        "final_manifest_sha256": {"$ref": "#/$defs/sha256"},
        "reservation_state_path": {"const": "release-state/status-clarification/zenodo-reservation.json"},
        "reservation_evidence_sha256": {"$ref": "#/$defs/sha256"},
        "report_doi": {"type": ["string", "null"], "pattern": "^10\\.5281/zenodo\\.[1-9][0-9]*$"}
      }
    }
  },
  "allOf": [
    {
      "if": {"properties": {"action": {"const": "inactive"}}, "required": ["action"]},
      "then": {
        "properties": {
          "confirm": {"const": "NOT_AUTHORIZED"},
          "release": {
            "properties": {
              "expected_source_commits": {
                "properties": {
                  "Goldkelch/qik-vrt": {"const": "0000000000000000000000000000000000000000"},
                  "ingolf-lohmann/qik-vrt": {"const": "0000000000000000000000000000000000000000"}
                }
              },
              "expected_source_tree": {"const": "0000000000000000000000000000000000000000"}
            }
          },
          "zenodo": {
            "properties": {
              "client_sha256": {"const": "0000000000000000000000000000000000000000000000000000000000000000"},
              "reservation_manifest_sha256": {"const": "0000000000000000000000000000000000000000000000000000000000000000"},
              "final_template_manifest_sha256": {"const": "0000000000000000000000000000000000000000000000000000000000000000"},
              "final_manifest_sha256": {"const": "0000000000000000000000000000000000000000000000000000000000000000"},
              "reservation_evidence_sha256": {"const": "0000000000000000000000000000000000000000000000000000000000000000"},
              "report_doi": {"const": null}
            }
          }
        }
      }
    },
    {
      "if": {"properties": {"action": {"const": "reserve"}}, "required": ["action"]},
      "then": {
        "properties": {
          "confirm": {"const": "RESERVE_ONE_NEW_STATUS_REPORT_DRAFT_NO_PUBLISH"},
          "release": {
            "properties": {
              "expected_source_commits": {
                "properties": {
                  "Goldkelch/qik-vrt": {"$ref": "#/$defs/nonzeroGitSha1"},
                  "ingolf-lohmann/qik-vrt": {"$ref": "#/$defs/nonzeroGitSha1"}
                }
              },
              "expected_source_tree": {"$ref": "#/$defs/nonzeroGitSha1"}
            }
          },
          "zenodo": {
            "properties": {
              "client_sha256": {"$ref": "#/$defs/nonzeroSha256"},
              "reservation_manifest_sha256": {"$ref": "#/$defs/nonzeroSha256"},
              "final_template_manifest_sha256": {"$ref": "#/$defs/nonzeroSha256"},
              "final_manifest_sha256": {"const": "0000000000000000000000000000000000000000000000000000000000000000"},
              "reservation_evidence_sha256": {"const": "0000000000000000000000000000000000000000000000000000000000000000"},
              "report_doi": {"const": null}
            }
          }
        }
      }
    },
    {
      "if": {"properties": {"action": {"const": "finalize"}}, "required": ["action"]},
      "then": {
        "properties": {
          "confirm": {"const": "TAG_SOURCE_PARENTS_AND_PUBLISH_RESERVED_STATUS_REPORT"},
          "release": {
            "properties": {
              "expected_source_commits": {
                "properties": {
                  "Goldkelch/qik-vrt": {"$ref": "#/$defs/nonzeroGitSha1"},
                  "ingolf-lohmann/qik-vrt": {"$ref": "#/$defs/nonzeroGitSha1"}
                }
              },
              "expected_source_tree": {"$ref": "#/$defs/nonzeroGitSha1"}
            }
          },
          "zenodo": {
            "properties": {
              "client_sha256": {"$ref": "#/$defs/nonzeroSha256"},
              "reservation_manifest_sha256": {"$ref": "#/$defs/nonzeroSha256"},
              "final_template_manifest_sha256": {"$ref": "#/$defs/nonzeroSha256"},
              "final_manifest_sha256": {"$ref": "#/$defs/nonzeroSha256"},
              "reservation_evidence_sha256": {"$ref": "#/$defs/nonzeroSha256"},
              "report_doi": {"type": "string", "pattern": "^10\\.5281/zenodo\\.[1-9][0-9]*$"}
            }
          }
        }
      }
    }
  ],
  "$defs": {
    "sha256": {"type": "string", "pattern": "^[0-9a-f]{64}$"},
    "nonzeroSha256": {"type": "string", "pattern": "^(?!0{64}$)[0-9a-f]{64}$"},
    "gitSha1": {"type": "string", "pattern": "^[0-9a-f]{40}$"},
    "nonzeroGitSha1": {"type": "string", "pattern": "^(?!0{40}$)[0-9a-f]{40}$"}
  }
}
