{
  "_license": {
    "copyright": "Copyright 2026 Ingolf Lohmann",
    "rights_holder": "Ingolf Lohmann",
    "license": "CC-BY-NC-ND-4.0",
    "license_text_ref": "LICENSES/CC-BY-NC-ND-4.0.txt",
    "classification": "release_authorization_json"
  },
  "$schema_ref": "../policy/qikvrt-status-report-release-request.schema.json",
  "schema": "qikvrt_status_report_release_request_v1",
  "schema_sha256": "371b34ad226b49467fc28d5085e58e3ec9bc0828dd9b7ed9ed82b49d2d2d8442",
  "request_id": "status-clarification-2026-07-22",
  "action": "finalize",
  "confirm": "TAG_SOURCE_PARENTS_AND_PUBLISH_RESERVED_STATUS_REPORT",
  "authorization_payload_sha256": "46ce20f39aa7a0962e707e7983f8e57c0a7d6f262ccb07ab28ea0e84c41cbcac",
  "repository_policy": {
    "authority_repository": "Goldkelch/qik-vrt",
    "mirror_repository": "ingolf-lohmann/qik-vrt",
    "release_ref": "refs/heads/main",
    "reserve_ref": "refs/heads/automation/status-clarification-reserve-20260722",
    "finalize_ref": "refs/heads/automation/status-clarification-finalize-20260722",
    "state_branch": "qikvrt/status-report-state"
  },
  "release": {
    "version": "2026.07.22-status-clarification-1.0.0",
    "tag": "v2026.07.22-status-clarification-1.0.0",
    "expected_source_commits": {
      "Goldkelch/qik-vrt": "d037a44d2893b9ea094d7cad55954223eb90a186",
      "ingolf-lohmann/qik-vrt": "7aaee4e1b182e18c9f0e927685f31d3c1190031a"
    },
    "expected_source_tree": "f03e2026e6164e537144e9f93af1e2d07749b7af",
    "tagger_name": "Ingolf Lohmann",
    "tagger_email": "ingolf.lohmann@live.com",
    "tagger_timestamp": "2026-07-22T00:00:00Z",
    "tag_message": "QIK-VRT official status clarification 1.0.0\n\nStandalone bounded status report. Tags identify the reviewed source-parent trees; authorization-marker commits are not release targets. No GitHub Release object and no mutation or new version of an existing Zenodo record."
  },
  "zenodo": {
    "client_path": "tools/qikvrt_status_zenodo.py",
    "client_sha256": "a093575e2ecc0d6acffe3f3cedc7eb6f05571b89cde18439869745ca7f5b1b8e",
    "reservation_manifest_path": "release/status-clarification-zenodo-reservation-manifest.json",
    "reservation_manifest_sha256": "9febae2b4e67b633e0b77b2f1317c4aa99142d365fe2f31bda9cd11c350c8a34",
    "final_template_manifest_path": "release/status-clarification-zenodo-template.json",
    "final_template_manifest_sha256": "f85f4cb01c9bc94bd6e0e1c42f8097738d012558cc3672d9a53707e729e59e60",
    "final_manifest_path": "release/status-clarification-zenodo.json",
    "final_manifest_sha256": "95fc1006289af3720ec4a1f3c1b7b4a31bbda877565023d98f1dfb372ad1a9c1",
    "reservation_state_path": "release-state/status-clarification/zenodo-reservation.json",
    "reservation_evidence_sha256": "e3db1a2d53dbc7349f71f014285652825092c92293a608070f5210ea8bcffaab",
    "report_doi": "10.5281/zenodo.21500322"
  }
}
